{
  "$schema": "https://json-schema.org/draft/2020-12/schema",
  "$id": "https://raw.githubusercontent.com/IvanKobtsev/LocaleBreeze/main/schemas/config-v1.schema.json",
  "title": "LocaleBreeze configuration",
  "type": "object",
  "additionalProperties": false,
  "required": ["dictionaries", "defaultLocale"],
  "properties": {
    "$schema": { "type": "string" },
    "dictionaries": { "type": "string", "description": "Pattern relative to the workspace root containing exactly one {locale} token and optionally one {namespace} token. Absolute paths are not allowed; parent-directory (..) segments may reference dictionaries outside the workspace." },
    "defaultLocale": { "type": "string", "minLength": 1 },
    "defaultNamespace": { "type": "string", "minLength": 1, "description": "Default i18next namespace. Required when {namespace} matches more than one namespace; inferred when exactly one is found." },
    "keySeparator": { "type": "string", "minLength": 1, "default": "." },
    "scopedFunctions": {
      "type": "array", "default": [],
      "items": { "$ref": "#/$defs/scopedFunction" }
    },
    "fullKeyFunctions": {
      "type": "array", "default": [],
      "items": { "$ref": "#/$defs/fullKeyFunction" }
    },
    "translationKeyTypes": { "$ref": "#/$defs/optionalConventions" },
    "translationKeyProps": { "$ref": "#/$defs/optionalConventions" },
    "ignoredScopes": {
      "type": "array",
      "default": [],
      "description": "Exact translation scopes and their descendants to exclude from frontend features.",
      "items": { "type": "string", "minLength": 1 }
    }
  },
  "$defs": {
    "functionName": { "type": "string", "pattern": "^[^\\s.]+(?:\\.[^\\s.]+)*$" },
    "scopedFunction": {
      "type": "object", "additionalProperties": false,
      "required": ["functionName"],
      "properties": {
        "functionName": { "$ref": "#/$defs/functionName" },
        "defaultNamespace": { "type": "string", "minLength": 1 },
        "translationMethod": { "$ref": "#/$defs/functionName" },
        "keyMethod": { "$ref": "#/$defs/functionName" }
      }
    },
    "fullKeyFunction": {
      "type": "object", "additionalProperties": false,
      "required": ["functionName"],
      "properties": {
        "functionName": { "$ref": "#/$defs/functionName" },
        "defaultNamespace": { "type": "string", "minLength": 1 }
      }
    },
    "conventions": {
      "type": "array", "minItems": 1, "uniqueItems": true,
      "items": { "type": "string", "pattern": "^[^\\s.]+(?:\\.[^\\s.]+)*$" }
    },
    "optionalConventions": {
      "type": "array", "uniqueItems": true, "default": [],
      "items": { "type": "string", "pattern": "^[^\\s.]+(?:\\.[^\\s.]+)*$" }
    }
  }
}
