{
  "$schema": "https://raw.githubusercontent.com/IvanKobtsev/LocaleBreeze/main/schemas/config-v1.schema.json",
  "dictionaries": "public/dictionaries/{locale}/{namespace}.json",
  "defaultLocale": "en",
  "defaultNamespace": "translation",
  "keySeparator": ".",
  "scopedFunctions": [
    {
      "functionName": "useScopedTranslation",
      "translationMethod": "t",
      "keyMethod": "key"
    }
  ],
  "fullKeyFunctions": [
    { "functionName": "translate" }
  ],
  "translationKeyTypes": ["TranslationKey"],
  "translationKeyProps": ["transKey"],
  "ignoredScopes": ["Server_Errors"]
}
